[
  {
    "id": "base-up-to-date",
    "class": "extrinsic",
    "probe": { "kind": "git", "check": "base-up-to-date" },
    "expected": "the candidate contains the base named by --base: the freshly fetched integration branch locally, the pull-request base under pull_request, and github.event.merge_group.base_sha under merge_group",
    "observed": null,
    "status": "pass",
    "remediation": "Locally, fetch the integration branch, rebase the candidate onto it, and pass it as --base. In the lane the base comes from the event; a blocked probe under merge_group means the queue base is not an ancestor of the entry, so the entry is evicted and re-enters the queue from a green head instead of being retried.",
    "depends_on": []
  },
  {
    "id": "clean-tree",
    "class": "intrinsic",
    "probe": { "kind": "git", "check": "clean-tree" },
    "expected": "no tracked or untracked change is pending",
    "observed": null,
    "status": "pass",
    "remediation": "Commit or remove every pending change so the candidate is exactly the commit under review.",
    "depends_on": []
  },
  {
    "id": "constitution-present",
    "class": "intrinsic",
    "probe": { "kind": "file", "path": "law/constitution.md", "must_exist": true },
    "expected": "law/constitution.md is present",
    "observed": null,
    "status": "pass",
    "remediation": "Restore law/constitution.md from the base.",
    "depends_on": []
  },
  {
    "id": "toolchain",
    "class": "extrinsic",
    "probe": { "kind": "toolchain", "manifest_path": ".devai/config/toolchain.json" },
    "expected": "node major, pnpm version, and git major match .devai/config/toolchain.json",
    "observed": null,
    "status": "pass",
    "remediation": "Install the node major, pnpm version, and git major declared in .devai/config/toolchain.json.",
    "depends_on": []
  }
]
